{
  "schema_version": "1.0",
  "rule_id": "satisfy_d2_1_1_girder_element",
  "name": "Satisfy D2.1.1 Girder Element",
  "description": "Satisfy requirement D2.1.1 by adding a GirderElement building element that satisfies the requirement and decomposes the Girder functional element.",
  "left": {
    "nodes": [
      {
        "id": "req_d2_1_1",
        "label": "Requirement",
        "props": {
          "external_id": "D2.1.1"
        }
      },
      {
        "id": "fe_girder",
        "label": "FunctionalElement",
        "props": {
          "name": "Girder"
        }
      }
    ],
    "edges": []
  },
  "interface": {
    "nodes": [
      {
        "id": "req_d2_1_1",
        "label": "Requirement",
        "props": {
          "external_id": "D2.1.1"
        }
      },
      {
        "id": "fe_girder",
        "label": "FunctionalElement",
        "props": {
          "name": "Girder"
        }
      }
    ],
    "edges": []
  },
  "right": {
    "nodes": [
      {
        "id": "req_d2_1_1",
        "label": "Requirement",
        "props": {
          "external_id": "D2.1.1"
        }
      },
      {
        "id": "fe_girder",
        "label": "FunctionalElement",
        "props": {
          "name": "Girder"
        }
      },
      {
        "id": "be_girder_element",
        "label": ["BuildingElement", "GirderElement"],
        "props": {
          "name": "GirderElement",
          "gh_file": "gh_samples/t_girder_d2.gh",
          "detail_level": "D2"
        }
      }
    ],
    "edges": [
      {
        "source": "req_d2_1_1",
        "target": "be_girder_element",
        "type": "SATISFIES"
      },
      {
        "source": "be_girder_element",
        "target": "fe_girder",
        "type": "DECOMPOSES"
      }
    ]
  },
  "nac": [
    {
      "nodes": [
        {
          "id": "req_d2_1_1",
          "label": "Requirement",
          "props": {
            "external_id": "D2.1.1"
          }
        },
        {
          "id": "nac_satisfied_target"
        }
      ],
      "edges": [
        {
          "source": "req_d2_1_1",
          "target": "nac_satisfied_target",
          "type": "SATISFIES"
        }
      ]
    }
  ]
}
