{
  "rule_id": "SubstructreDecomp",
  "name": "Decompose substructure into abutment and abutment elements",
  "nac": [
    {
      "nodes": [
        {
          "id": "substructure",
          "label": "FunctionalElement",
          "props": {
            "name": "Substructure"
          }
        },
        {
          "id": "abutment",
          "label": "FunctionalElement",
          "props": {
            "name": "Abutment"
          }
        }
      ],
      "edges": [
        {
          "source": "abutment",
          "target": "substructure",
          "type": "DECOMPOSES"
        }
      ]
    }
  ],
  "left": {
    "nodes": [
      {
        "id": "substructure",
        "label": "FunctionalElement",
        "props": {
          "name": "Substructure"
        }
      }
    ],
    "edges": []
  },
  "interface": {
    "nodes": [
      {
        "id": "substructure",
        "label": "FunctionalElement",
        "props": {
          "name": "Substructure"
        }
      }
    ],
    "edges": []
  },
  "right": {
    "nodes": [
      {
        "id": "substructure",
        "label": "FunctionalElement",
        "props": {
          "name": "Substructure"
        }
      },
      {
        "id": "abutment",
        "label": "FunctionalElement",
        "props": {
          "name": "Abutment"
        }
      },
      {
        "id": "abutment_element_1",
        "label": ["BuildingElement", "AbutmentElement"],
        "props": {
          "gh_file": "gh_samples/abutment_d1.gh",
          "name": "AbutmentElement1",
          "detail_level": "D1"
        }
      },
      {
        "id": "abutment_element_2",
        "label": ["BuildingElement", "AbutmentElement"],
        "props": {
          "gh_file": "gh_samples/abutment_d1.gh",
          "name": "AbutmentElement2",
          "detail_level": "D1"
        }
      }
    ],
    "edges": [
      {
        "source": "abutment",
        "target": "substructure",
        "type": "DECOMPOSES"
      },
      {
        "source": "abutment_element_1",
        "target": "abutment",
        "type": "DECOMPOSES"
      },
      {
        "source": "abutment_element_2",
        "target": "abutment",
        "type": "DECOMPOSES"
      }
    ]
  }
}
