{
  "schema_version": "1.0",
  "rule_id": "decompose_abutment_d1_if1",
  "name": "Decompose abutment D1 into D2 walls (interface variant 1)",
  "description": "Decompose a D1 abutment element into two D2 side walls and a D2 middle wall, wiring interfaces between the walls and to the D2 girder.",
  "nac": [
    {
      "nodes": [
        {
          "id": "abutment_element_d1",
          "label": "AbutmentElement",
          "props": {
            "detail_level": "D1"
          }
        },
        {
          "id": "existing_middle_wall_d2",
          "label": "AbutmentMiddleWallElement",
          "props": {
            "detail_level": "D2"
          }
        }
      ],
      "edges": [
        {
          "source": "existing_middle_wall_d2",
          "target": "abutment_element_d1",
          "type": "DECOMPOSES"
        }
      ]
    }
  ],
  "left": {
    "nodes": [
      {
        "id": "req_d2_2",
        "label": "Requirement",
        "props": {
          "external_id": "D2.2"
        }
      },
      {
        "id": "abutment_element_d1",
        "label": "AbutmentElement",
        "props": {
          "detail_level": "D1"
        }
      },
      {
        "id": "girder_element_d1",
        "label": "GirderElement",
        "props": {
          "detail_level": "D1",
          "gh_file": "gh_samples/Girder.gh"
        }
      },
      {
        "id": "girder_element_d2",
        "label": "GirderElement",
        "props": {
          "detail_level": "D2",
          "gh_file": "gh_samples/t_girder_d2.gh"
        }
      }
    ],
    "edges": [
      {
        "source": "abutment_element_d1",
        "target": "girder_element_d1",
        "type": "INTERFACES",
        "props": {
          "source_interface": "ABT_interface2",
          "target_interface": "GRD_interface1"
        }
      }
    ]
  },
  "interface": {
    "nodes": [
      {
        "id": "req_d2_2",
        "label": "Requirement",
        "props": {
          "external_id": "D2.2"
        }
      },
      {
        "id": "abutment_element_d1",
        "label": "AbutmentElement",
        "props": {
          "detail_level": "D1"
        }
      },
      {
        "id": "girder_element_d1",
        "label": "GirderElement",
        "props": {
          "detail_level": "D1",
          "gh_file": "gh_samples/Girder.gh"
        }
      },
      {
        "id": "girder_element_d2",
        "label": "GirderElement",
        "props": {
          "detail_level": "D2",
          "gh_file": "gh_samples/t_girder_d2.gh"
        }
      }
    ],
    "edges": [
      {
        "source": "abutment_element_d1",
        "target": "girder_element_d1",
        "type": "INTERFACES",
        "props": {
          "source_interface": "ABT_interface2",
          "target_interface": "GRD_interface1"
        }
      }
    ]
  },
  "right": {
    "nodes": [
      {
        "id": "req_d2_2",
        "label": "Requirement",
        "props": {
          "external_id": "D2.2"
        }
      },
      {
        "id": "abutment_element_d1",
        "label": "AbutmentElement",
        "props": {
          "detail_level": "D1"
        }
      },
      {
        "id": "girder_element_d1",
        "label": "GirderElement",
        "props": {
          "detail_level": "D1",
          "gh_file": "gh_samples/Girder.gh"
        }
      },
      {
        "id": "girder_element_d2",
        "label": "GirderElement",
        "props": {
          "detail_level": "D2",
          "gh_file": "gh_samples/t_girder_d2.gh"
        }
      },
      {
        "id": "abutment_1_side_wall_1",
        "label": "AbutmentSideWallElement",
        "props": {
          "detail_level": "D2",
          "gh_file": "gh_samples/abutment_side_d2.gh"
        }
      },
      {
        "id": "abutment_1_side_wall_2",
        "label": "AbutmentSideWallElement",
        "props": {
          "detail_level": "D2",
          "gh_file": "gh_samples/abutment_side_d2.gh"
        }
      },
      {
        "id": "abutment_1_middle_wall",
        "label": "AbutmentMiddleWallElement",
        "props": {
          "detail_level": "D2",
          "gh_file": "gh_samples/abutment_middle_d2.gh"
        }
      }
    ],
    "edges": [
      {
        "source": "abutment_element_d1",
        "target": "girder_element_d1",
        "type": "INTERFACES",
        "props": {
          "source_interface": "ABT_interface2",
          "target_interface": "GRD_interface1"
        }
      },
      {
        "source": "req_d2_2",
        "target": "abutment_1_middle_wall",
        "type": "SATISFIES"
      },
      {
        "source": "abutment_1_side_wall_1",
        "target": "abutment_element_d1",
        "type": "DECOMPOSES"
      },
      {
        "source": "abutment_1_side_wall_2",
        "target": "abutment_element_d1",
        "type": "DECOMPOSES"
      },
      {
        "source": "abutment_1_middle_wall",
        "target": "abutment_element_d1",
        "type": "DECOMPOSES"
      },
      {
        "source": "abutment_1_side_wall_1",
        "target": "abutment_1_middle_wall",
        "type": "INTERFACES",
        "props": {
          "source_interface": "ABT_SD_interface2",
          "target_interface": "ABT_MD_interface1"
        }
      },
      {
        "source": "abutment_1_side_wall_2",
        "target": "abutment_1_middle_wall",
        "type": "INTERFACES",
        "props": {
          "source_interface": "ABT_SD_interface2",
          "target_interface": "ABT_MD_interface2"
        }
      },
      {
        "source": "abutment_1_middle_wall",
        "target": "girder_element_d2",
        "type": "INTERFACES",
        "props": {
          "source_interface": "ABT_MD_interface4",
          "target_interface": "D2_GRD_interface1"
        }
      }
    ]
  }
}
