{
  "rule_id": "satisfy_d1_1_bridge",
  "name": "Requirement D1.1 satisfied by Bridge decomposition",
  "nac": [
    {
      "nodes": [
        {
          "id": "req_d1_1",
          "label": "Requirement",
          "props": {
            "external_id": "D1.1"
          }
        },
        {
          "id": "existing_satisfier"
        }
      ],
      "edges": [
        {
          "source": "req_d1_1",
          "target": "existing_satisfier",
          "type": "SATISFIES"
        }
      ]
    }
  ],
  "left": {
    "nodes": [
      {
        "id": "req_d1_1",
        "label": "Requirement",
        "props": {
          "external_id": "D1.1"
        }
      }
    ],
    "edges": []
  },
  "interface": {
    "nodes": [
      {
        "id": "req_d1_1",
        "label": "Requirement",
        "props": {
          "external_id": "D1.1"
        }
      }
    ],
    "edges": []
  },
  "right": {
    "nodes": [
      {
        "id": "req_d1_1",
        "label": "Requirement",
        "props": {
          "external_id": "D1.1"
        }
      },
      {
        "id": "fe_bridge",
        "label": "FunctionalElement",
        "props": {
          "name": "Bridge"
        }
      },
      {
        "id": "fe_substructure",
        "label": "FunctionalElement",
        "props": {
          "name": "Substructure"
        }
      },
      {
        "id": "fe_superstructure",
        "label": "FunctionalElement",
        "props": {
          "name": "Superstructure"
        }
      },
      {
        "id": "fe_foundation",
        "label": "FunctionalElement",
        "props": {
          "name": "Foundation"
        }
      }
    ],
    "edges": [
      {
        "source": "req_d1_1",
        "target": "fe_bridge",
        "type": "SATISFIES"
      },
      {
        "source": "fe_substructure",
        "target": "fe_bridge",
        "type": "DECOMPOSES"
      },
      {
        "source": "fe_superstructure",
        "target": "fe_bridge",
        "type": "DECOMPOSES"
      },
      {
        "source": "fe_foundation",
        "target": "fe_bridge",
        "type": "DECOMPOSES"
      }
    ]
  },
  "description": "Marks the D1.1 requirement as satisfied by the Bridge functional element and decomposes it into Substructure, Superstructure, and Foundation."
}
