{
  "rule_id": "refine_girder_d1_to_d2",
  "description": "Refines a D1 girder into a decomposing D2 girder when no such D2 decomposition already exists.",
  "left": {
    "nodes": [
      {
        "id": "girder_element_d1",
        "label": [
          "BuildingElement",
          "GirderElement"
        ],
        "props": {
          "name": "GirderElement",
          "gh_file": "gh_samples/Girder.gh",
          "detail_level": "D1"
        }
      }
    ]
  },
  "interface": {
    "nodes": [
      {
        "id": "girder_element_d1",
        "label": [
          "BuildingElement",
          "GirderElement"
        ],
        "props": {
          "name": "GirderElement",
          "gh_file": "gh_samples/Girder.gh",
          "detail_level": "D1"
        }
      }
    ]
  },
  "right": {
    "nodes": [
      {
        "id": "girder_element_d1",
        "label": [
          "BuildingElement",
          "GirderElement"
        ],
        "props": {
          "name": "GirderElement",
          "gh_file": "gh_samples/Girder.gh",
          "detail_level": "D1"
        }
      },
      {
        "id": "girder_element_d2",
        "label": [
          "BuildingElement",
          "GirderElement"
        ],
        "props": {
          "name": "GirderElement",
          "gh_file": "gh_samples/t_girder_d2.gh",
          "detail_level": "D2"
        }
      }
    ],
    "edges": [
      {
        "source": "girder_element_d2",
        "target": "girder_element_d1",
        "type": "DECOMPOSES"
      }
    ]
  },
  "nac": [
    {
      "nodes": [
        {
          "id": "girder_element_d1",
          "label": [
            "BuildingElement",
            "GirderElement"
          ],
          "props": {
            "name": "GirderElement",
            "gh_file": "gh_samples/Girder.gh",
            "detail_level": "D1"
          }
        },
        {
          "id": "girder_element_d2",
          "label": [
            "BuildingElement",
            "GirderElement"
          ],
          "props": {
            "gh_file": "gh_samples/t_girder_d2.gh",
            "detail_level": "D2"
          }
        }
      ],
      "edges": [
        {
          "source": "girder_element_d2",
          "target": "girder_element_d1",
          "type": "DECOMPOSES"
        }
      ]
    }
  ]
}
