{
  "rule_id": "attach_kappe_d3_if6",
  "description": "Attach a D2 Kappe element to a D2 girder module on girder interface 5 when that interface pair is still unused.",
  "left": {
    "nodes": [
      {
        "id": "req_d2_4",
        "label": "Requirement",
        "props": {
          "external_id": "D2.4"
        }
      },
      {
        "id": "req_d2_2",
        "label": "Requirement",
        "props": {
          "external_id": "D2.2"
        }
      },
      {
        "id": "girder_module",
        "label": [
          "BuildingElement",
          "GirderElement"
        ],
        "props": {
          "gh_file": "gh_samples/t_girder_module_d3.gh",
          "detail_level": "D2"
        }
      }
    ]
  },
  "interface": {
    "nodes": [
      {
        "id": "req_d2_4",
        "label": "Requirement",
        "props": {
          "external_id": "D2.4"
        }
      },
      {
        "id": "req_d2_2",
        "label": "Requirement",
        "props": {
          "external_id": "D2.2"
        }
      },
      {
        "id": "girder_module",
        "label": [
          "BuildingElement",
          "GirderElement"
        ],
        "props": {
          "gh_file": "gh_samples/t_girder_module_d3.gh",
          "detail_level": "D2"
        }
      }
    ]
  },
  "right": {
    "nodes": [
      {
        "id": "req_d2_4",
        "label": "Requirement",
        "props": {
          "external_id": "D2.4"
        }
      },
      {
        "id": "req_d2_2",
        "label": "Requirement",
        "props": {
          "external_id": "D2.2"
        }
      },
      {
        "id": "girder_module",
        "label": [
          "BuildingElement",
          "GirderElement"
        ],
        "props": {
          "gh_file": "gh_samples/t_girder_module_d3.gh",
          "detail_level": "D2"
        }
      },
      {
        "id": "kappe_element",
        "label": [
          "BuildingElement",
          "KappeElement"
        ],
        "props": {
          "gh_file": "gh_samples/kappe_d3.gh",
          "detail_level": "D2"
        }
      }
    ],
    "edges": [
      {
        "source": "req_d2_4",
        "target": "kappe_element",
        "type": "SATISFIES"
      },
      {
        "source": "req_d2_2",
        "target": "kappe_element",
        "type": "SATISFIES"
      },
      {
        "source": "kappe_element",
        "target": "girder_module",
        "type": "DECOMPOSES"
      },
      {
        "source": "girder_module",
        "target": "kappe_element",
        "type": "INTERFACES",
        "props": {
          "src_interface": "D3_GRD_interface5",
          "dst_interface": "KP_interface1"
        }
      }
    ]
  },
  "nac": [
    {
      "nodes": [
        {
          "id": "girder_module",
          "label": [
            "BuildingElement",
            "GirderElement"
          ],
          "props": {
            "gh_file": "gh_samples/t_girder_module_d3.gh",
            "detail_level": "D2"
          }
        },
        {
          "id": "existing_kappe",
          "label": [
            "BuildingElement",
            "KappeElement"
          ],
          "props": {
            "gh_file": "gh_samples/kappe_d3.gh",
            "detail_level": "D2"
          }
        }
      ],
      "edges": [
        {
          "source": "girder_module",
          "target": "existing_kappe",
          "type": "INTERFACES",
          "props": {
            "src_interface": "D3_GRD_interface5",
            "dst_interface": "KP_interface1"
          }
        }
      ]
    }
  ]
}
