{
  "rule_id": "decompose_abutment_d1_if1_if2",
  "name": "Decompose D1 abutment linked to D1 girder interfaces 1 and 2 into D2 side and middle walls",
  "nac": [
    {
      "nodes": [
        {
          "id": "abutment_element_d1",
          "label": [
            "BuildingElement",
            "AbutmentElement"
          ],
          "props": {
            "gh_file": "gh_samples/abutment_d1.gh",
            "detail_level": "D1"
          }
        },
        {
          "id": "existing_middle_wall",
          "label": [
            "BuildingElement",
            "AbutmentMiddleWallElement"
          ],
          "props": {
            "detail_level": "D2"
          }
        }
      ],
      "edges": [
        {
          "source": "existing_middle_wall",
          "target": "abutment_element_d1",
          "type": "DECOMPOSES"
        }
      ]
    }
  ],
  "left": {
    "nodes": [
      {
        "id": "abutment_element_d1",
        "label": [
          "BuildingElement",
          "AbutmentElement"
        ],
        "props": {
          "gh_file": "gh_samples/abutment_d1.gh",
          "detail_level": "D1"
        }
      },
      {
        "id": "girder_element_d1",
        "label": [
          "BuildingElement",
          "GirderElement"
        ],
        "props": {
          "gh_file": "gh_samples/Girder.gh",
          "detail_level": "D1"
        }
      },
      {
        "id": "girder_element_d2",
        "label": [
          "BuildingElement",
          "GirderElement"
        ],
        "props": {
          "gh_file": "gh_samples/t_girder_d2.gh",
          "detail_level": "D2"
        }
      }
    ],
    "edges": [
      {
        "source": "abutment_element_d1",
        "target": "girder_element_d1",
        "type": "INTERFACES",
        "props": {
          "src_interface": "ABT_interface2",
          "dst_interface": "GRD_interface1"
        }
      },
      {
        "source": "abutment_element_d1",
        "target": "girder_element_d1",
        "type": "INTERFACES",
        "props": {
          "src_interface": "ABT_interface2",
          "dst_interface": "GRD_interface2"
        }
      }
    ]
  },
  "interface": {
    "nodes": [
      {
        "id": "abutment_element_d1",
        "label": [
          "BuildingElement",
          "AbutmentElement"
        ],
        "props": {
          "gh_file": "gh_samples/abutment_d1.gh",
          "detail_level": "D1"
        }
      },
      {
        "id": "girder_element_d1",
        "label": [
          "BuildingElement",
          "GirderElement"
        ],
        "props": {
          "gh_file": "gh_samples/Girder.gh",
          "detail_level": "D1"
        }
      },
      {
        "id": "girder_element_d2",
        "label": [
          "BuildingElement",
          "GirderElement"
        ],
        "props": {
          "gh_file": "gh_samples/t_girder_d2.gh",
          "detail_level": "D2"
        }
      }
    ],
    "edges": [
      {
        "source": "abutment_element_d1",
        "target": "girder_element_d1",
        "type": "INTERFACES",
        "props": {
          "src_interface": "ABT_interface2",
          "dst_interface": "GRD_interface1"
        }
      },
      {
        "source": "abutment_element_d1",
        "target": "girder_element_d1",
        "type": "INTERFACES",
        "props": {
          "src_interface": "ABT_interface2",
          "dst_interface": "GRD_interface2"
        }
      }
    ]
  },
  "right": {
    "nodes": [
      {
        "id": "abutment_element_d1",
        "label": [
          "BuildingElement",
          "AbutmentElement"
        ],
        "props": {
          "gh_file": "gh_samples/abutment_d1.gh",
          "detail_level": "D1"
        }
      },
      {
        "id": "girder_element_d1",
        "label": [
          "BuildingElement",
          "GirderElement"
        ],
        "props": {
          "gh_file": "gh_samples/Girder.gh",
          "detail_level": "D1"
        }
      },
      {
        "id": "girder_element_d2",
        "label": [
          "BuildingElement",
          "GirderElement"
        ],
        "props": {
          "gh_file": "gh_samples/t_girder_d2.gh",
          "detail_level": "D2"
        }
      },
      {
        "id": "abutment_1_side_wall_1",
        "label": [
          "BuildingElement",
          "AbutmentSideWallElement"
        ],
        "props": {
          "name": "Abutment1SideWall1",
          "gh_file": "gh_samples/abutment_side_d2.gh",
          "detail_level": "D2"
        }
      },
      {
        "id": "abutment_1_side_wall_2",
        "label": [
          "BuildingElement",
          "AbutmentSideWallElement"
        ],
        "props": {
          "name": "Abutment1SideWall2",
          "gh_file": "gh_samples/abutment_side_d2.gh",
          "detail_level": "D2"
        }
      },
      {
        "id": "abutment_1_middle_wall",
        "label": [
          "BuildingElement",
          "AbutmentMiddleWallElement"
        ],
        "props": {
          "name": "Abutment1MiddleWall",
          "gh_file": "gh_samples/abutment_middle_d2.gh",
          "detail_level": "D2"
        }
      },
      {
        "id": "abutment_2_side_wall_1",
        "label": [
          "BuildingElement",
          "AbutmentSideWallElement"
        ],
        "props": {
          "name": "Abutment2SideWall1",
          "gh_file": "gh_samples/abutment_side_d2.gh",
          "detail_level": "D2"
        }
      },
      {
        "id": "abutment_2_side_wall_2",
        "label": [
          "BuildingElement",
          "AbutmentSideWallElement"
        ],
        "props": {
          "name": "Abutment2SideWall2",
          "gh_file": "gh_samples/abutment_side_d2.gh",
          "detail_level": "D2"
        }
      },
      {
        "id": "abutment_2_middle_wall",
        "label": [
          "BuildingElement",
          "AbutmentMiddleWallElement"
        ],
        "props": {
          "name": "Abutment2MiddleWall",
          "gh_file": "gh_samples/abutment_middle_d2.gh",
          "detail_level": "D2"
        }
      }
    ],
    "edges": [
      {
        "source": "abutment_element_d1",
        "target": "girder_element_d1",
        "type": "INTERFACES",
        "props": {
          "src_interface": "ABT_interface2",
          "dst_interface": "GRD_interface1"
        }
      },
      {
        "source": "abutment_element_d1",
        "target": "girder_element_d1",
        "type": "INTERFACES",
        "props": {
          "src_interface": "ABT_interface2",
          "dst_interface": "GRD_interface2"
        }
      },
      {
        "source": "abutment_1_side_wall_1",
        "target": "abutment_element_d1",
        "type": "DECOMPOSES"
      },
      {
        "source": "abutment_1_side_wall_2",
        "target": "abutment_element_d1",
        "type": "DECOMPOSES"
      },
      {
        "source": "abutment_1_middle_wall",
        "target": "abutment_element_d1",
        "type": "DECOMPOSES"
      },
      {
        "source": "abutment_2_side_wall_1",
        "target": "abutment_element_d1",
        "type": "DECOMPOSES"
      },
      {
        "source": "abutment_2_side_wall_2",
        "target": "abutment_element_d1",
        "type": "DECOMPOSES"
      },
      {
        "source": "abutment_2_middle_wall",
        "target": "abutment_element_d1",
        "type": "DECOMPOSES"
      },
      {
        "source": "abutment_1_side_wall_1",
        "target": "abutment_1_middle_wall",
        "type": "INTERFACES",
        "props": {
          "src_interface": "ABT_SD_interface2",
          "dst_interface": "ABT_MD_interface1"
        }
      },
      {
        "source": "abutment_1_side_wall_2",
        "target": "abutment_1_middle_wall",
        "type": "INTERFACES",
        "props": {
          "src_interface": "ABT_SD_interface2",
          "dst_interface": "ABT_MD_interface2"
        }
      },
      {
        "source": "abutment_1_middle_wall",
        "target": "girder_element_d2",
        "type": "INTERFACES",
        "props": {
          "src_interface": "ABT_MD_interface4",
          "dst_interface": "D2_GRD_interface1"
        }
      },
      {
        "source": "abutment_2_side_wall_1",
        "target": "abutment_2_middle_wall",
        "type": "INTERFACES",
        "props": {
          "src_interface": "ABT_SD_interface2",
          "dst_interface": "ABT_MD_interface1"
        }
      },
      {
        "source": "abutment_2_side_wall_2",
        "target": "abutment_2_middle_wall",
        "type": "INTERFACES",
        "props": {
          "src_interface": "ABT_SD_interface2",
          "dst_interface": "ABT_MD_interface2"
        }
      },
      {
        "source": "abutment_2_middle_wall",
        "target": "girder_element_d2",
        "type": "INTERFACES",
        "props": {
          "src_interface": "ABT_MD_interface4",
          "dst_interface": "D2_GRD_interface2"
        }
      }
    ]
  },
  "description": "Splits a D1 abutment connected on both girder interfaces into D2 side and middle walls."
}
